{
  "schemaVersion": 1,
  "revision": "da3d50e0251d7b341709a7163c8409ba78fc16d5a1f410556399b434388444c7",
  "publishedAt": "2026-10-27T11:53:07.310Z",
  "deployments": [
    {
      "chainId": 1,
      "family": "euler-simple",
      "channel": "stable",
      "status": "active",
      "version": "1.0.2",
      "endpoint": "https://api.goldsky.com/api/public/project_cm4iagnemt1wp01xn4gh1agft/subgraphs/euler-simple-mainnet/1.0.2/gn",
      "deploymentId": "QmarAreSkQbcWfUbKJW2EJ1N3XyAGxzHVnzG85F8B3ZmSe",
      "capabilities": [
        "account-vault-discovery",
        "vault-factory-lookup"
      ]
    },
    {
      "chainId": 130,
      "family": "euler-simple",
      "channel": "stable",
      "status": "active",
      "version": "1.0.1",
      "endpoint": "https://api.goldsky.com/api/public/project_cm4iagnemt1wp01xn4gh1agft/subgraphs/euler-simple-unichain/1.0.1/gn",
      "deploymentId": "QmNnvfB1gy2TvKLvMQABTwQqkrUQ56NAD1yVwG9d1RnkWC",
      "capabilities": [
        "account-vault-discovery",
        "vault-factory-lookup"
      ]
    },
    {
      "chainId": 143,
      "family": "euler-simple",
      "channel": "stable",
      "status": "active",
      "version": "1.0.1",
      "endpoint": "https://api.goldsky.com/api/public/project_cm4iagnemt1wp01xn4gh1agft/subgraphs/euler-simple-monad/1.0.1/gn",
      "deploymentId": "QmWeVDMdAQWpMvin3i8Ct7vr9yvs34KaDSDNeqfqft8gvS",
      "capabilities": [
        "account-vault-discovery",
        "vault-factory-lookup"
      ]
    },
    {
      "chainId": 146,
      "family": "euler-simple",
      "channel": "stable",
      "status": "active",
      "version": "1.0.1",
      "endpoint": "https://api.goldsky.com/api/public/project_cm4iagnemt1wp01xn4gh1agft/subgraphs/euler-simple-sonic/1.0.1/gn",
      "deploymentId": "QmUhE1aP9pdj5egSyeR7uSLVzueaVfWw6DMjKKMF7xACoM",
      "capabilities": [
        "account-vault-discovery",
        "vault-factory-lookup"
      ]
    },
    {
      "chainId": 239,
      "family": "euler-simple",
      "channel": "stable",
      "status": "active",
      "version": "1.0.1",
      "endpoint": "https://api.goldsky.com/api/public/project_cm4iagnemt1wp01xn4gh1agft/subgraphs/euler-simple-tac/1.0.1/gn",
      "deploymentId": "QmUeL1DQfv1dpGLqAH5Wj3EN2uhp6379Ek6VSwuW2Zw6m4",
      "capabilities": [
        "account-vault-discovery",
        "vault-factory-lookup"
      ]
    },
    {
      "chainId": 56,
      "family": "euler-simple",
      "channel": "stable",
      "status": "active",
      "version": "1.0.1",
      "endpoint": "https://api.goldsky.com/api/public/project_cm4iagnemt1wp01xn4gh1agft/subgraphs/euler-simple-bsc/1.0.1/gn",
      "deploymentId": "QmYrPoWBnJQYZbMtXKwxwamV4Pa45EjXVooAqyqhpx2i5q",
      "capabilities": [
        "account-vault-discovery",
        "vault-factory-lookup"
      ]
    }
  ]
}
